{
  "$schema": "./schema.json",
  "version": "1.0.0",
  "updated": "2026-07-20",
  "reference": "https://learn.microsoft.com/en-us/windows/privacy/windows-11-endpoints-non-enterprise-editions",
  "endpoints": [
    { "domain": "v10.events.data.microsoft.com", "service": "Diagnosedienst (Connected User Experiences and Telemetry)", "process": "svchost.exe -k utcsvc", "categories": ["App-Nutzung", "Geräte-ID", "Hardwarekonfiguration", "Betriebssystem-Build"], "trigger": "Systemstart und periodische Übertragung", "severity": "telemetry", "evidence": "documented", "editions": ["Home", "Pro", "Education", "Enterprise"] },
    { "domain": "self.events.data.microsoft.com", "service": "Diagnosedienst und Office-Ereignispipeline", "process": "svchost.exe -k utcsvc", "categories": ["App-Nutzung", "Diagnoseereignisse"], "trigger": "Periodische Übertragung", "severity": "telemetry", "evidence": "documented", "editions": ["Home", "Pro", "Education"] },
    { "domain": "mobile.events.data.microsoft.com", "service": "Anwendungstelemetrie (1DS-SDK)", "process": "diverse Anwendungsprozesse", "categories": ["App-Nutzung", "App-Diagnose"], "trigger": "Anwendungsnutzung, Sammelübertragung", "severity": "telemetry", "evidence": "observed", "notes": "Beobachtet am 2026-07-20 über das DNS-Ereignisprotokoll, Windows 11 Home Build 26200, Stufe Required. Prozesszuordnung offen.", "editions": ["Home"] },
    { "domain": "v20.events.data.microsoft.com", "service": "Anwendungstelemetrie (1DS-Collector)", "process": "msedge.exe / msedgewebview2.exe", "categories": ["App-Nutzung", "App-Diagnose"], "trigger": "Anwendungsnutzung, Sammelübertragung", "severity": "telemetry", "evidence": "observed", "notes": "Beobachtet am 2026-07-20 über das DNS-Ereignisprotokoll, Windows 11 Home Build 26200, Stufe Required.", "editions": ["Home"] },
    { "domain": "server.events.data.microsoft.com", "service": "Anwendungstelemetrie (1DS-Collector)", "process": "diverse Anwendungsprozesse", "categories": ["App-Diagnose"], "trigger": "Anwendungsnutzung, Sammelübertragung", "severity": "telemetry", "evidence": "observed", "notes": "Beobachtet am 2026-07-20 über das DNS-Ereignisprotokoll, Windows 11 Home Build 26200.", "editions": ["Home"] },
    { "domain": "functional.events.data.microsoft.com", "service": "Funktionale Ereignisdaten", "process": "svchost.exe", "categories": ["Diagnoseereignisse"], "trigger": "Ereignisgesteuert", "severity": "telemetry", "evidence": "documented", "editions": ["Pro"] },
    { "domain": "browser.events.data.msn.com", "service": "Browser- und Widget-Ereignisdaten", "process": "msedgewebview2.exe", "categories": ["Interaktionssignale"], "trigger": "Widget- und Browsernutzung", "severity": "telemetry", "evidence": "documented", "editions": ["Pro"] },
    { "domain": "watson.telemetry.microsoft.com", "service": "Fehlerberichterstattung", "process": "WerFault.exe / wermgr.exe", "categories": ["Absturzberichte", "Speicherabbilder", "Modulversionen", "Aufrufverläufe"], "trigger": "Ereignisgesteuert bei Programmabsturz", "severity": "telemetry", "evidence": "documented", "editions": ["Home", "Pro", "Education", "Enterprise"] },
    { "domain": "watson.events.data.microsoft.com", "service": "Fehlerberichterstattung (Ereignispipeline)", "process": "wermgr.exe", "categories": ["Absturzberichte"], "trigger": "Ereignisgesteuert bei Programmabsturz", "severity": "telemetry", "evidence": "documented", "editions": ["Pro"] },
    { "domain": "settings-win.data.microsoft.com", "service": "Konfigurationsabruf für Systemkomponenten", "process": "svchost.exe", "categories": ["Geräteattribute"], "trigger": "Periodisch", "severity": "telemetry", "evidence": "documented", "editions": ["Home", "Pro", "Education"] },
    { "domain": "settings.data.microsoft.com", "service": "Konfigurationsabruf für Anwendungen", "process": "svchost.exe", "categories": ["Geräteattribute"], "trigger": "Anwendungsstart, periodisch", "severity": "telemetry", "evidence": "documented", "editions": ["Home", "Pro", "Education"] },
    { "domain": "wdcp.microsoft.com", "service": "Defender-Cloudschutz", "process": "MsMpEng.exe", "categories": ["Dateiprüfsummen", "Dateipfade", "Herkunftsadressen", "Zertifikatsinformationen"], "trigger": "Ereignisgesteuert bei Dateiprüfung", "severity": "security", "evidence": "documented", "editions": ["Home", "Pro", "Education", "Enterprise"] },
    { "domain": "wdcpalt.microsoft.com", "service": "Defender-Cloudschutz (Ausweichziel)", "process": "MsMpEng.exe", "categories": ["Dateiprüfsummen", "Dateipfade"], "trigger": "Ereignisgesteuert bei Dateiprüfung", "severity": "security", "evidence": "documented", "editions": ["Home", "Pro", "Education", "Enterprise"] },
    { "domain": "definitionupdates.microsoft.com", "service": "Defender-Signaturaktualisierung", "process": "MsMpEng.exe", "categories": ["Keine Nutzerdaten"], "trigger": "Mehrfach täglich", "severity": "security", "evidence": "documented", "editions": ["Home", "Pro"] },
    { "domain": "*.smartscreen.microsoft.com", "service": "SmartScreen-Reputationsprüfung", "process": "smartscreen.exe", "categories": ["Adressen und Adressprüfsummen", "Dateiprüfsummen", "Programmnamen"], "trigger": "Ereignisgesteuert bei Download oder Ausführung", "severity": "security", "evidence": "documented", "editions": ["Home", "Pro", "Education"] },
    { "domain": "*.smartscreen-prod.microsoft.com", "service": "SmartScreen (Produktivumgebung)", "process": "smartscreen.exe", "categories": ["Adressen und Adressprüfsummen", "Dateiprüfsummen"], "trigger": "Ereignisgesteuert", "severity": "security", "evidence": "documented", "editions": ["Home", "Pro", "Education"] },
    { "domain": "checkappexec.microsoft.com", "service": "SmartScreen-Ausführungsprüfung", "process": "smartscreen.exe", "categories": ["Dateiprüfsummen", "Programmnamen"], "trigger": "Ereignisgesteuert bei Programmstart", "severity": "security", "evidence": "documented", "editions": ["Home", "Pro", "Education"] },
    { "domain": "*.windowsupdate.com", "service": "Windows Update (Auslieferung)", "process": "svchost.exe (wuauserv) / MoUsoCoreWorker.exe", "categories": ["Aktualisierungsmetadaten"], "trigger": "Geplante Aufgabe UpdateOrchestrator", "severity": "update", "evidence": "documented", "editions": ["Home", "Pro", "Education", "Enterprise"] },
    { "domain": "*.update.microsoft.com", "service": "Windows Update (Suche und Steuerung)", "process": "svchost.exe (wuauserv)", "categories": ["Installierte Aktualisierungen", "Betriebssystem-Build", "Hardwarekennungen zur Treiberzuordnung"], "trigger": "Geplante Aufgabe UpdateOrchestrator", "severity": "update", "evidence": "documented", "editions": ["Home", "Pro", "Education", "Enterprise"] },
    { "domain": "*.delivery.mp.microsoft.com", "service": "Übermittlungsoptimierung", "process": "DoSvc (svchost.exe)", "categories": ["Downloadstatistik"], "trigger": "Bei Aktualisierungsdownloads", "severity": "update", "evidence": "documented", "editions": ["Home", "Pro", "Education", "Enterprise"] },
    { "domain": "*.prod.do.dsp.mp.microsoft.com", "service": "Übermittlungsoptimierung (Peer-Koordination)", "process": "DoSvc (svchost.exe)", "categories": ["Downloadstatistik", "Peer-Metadaten"], "trigger": "Bei Aktualisierungsdownloads", "severity": "update", "evidence": "documented", "editions": ["Home", "Pro", "Education", "Enterprise"] },
    { "domain": "tsfe.trafficshaping.dsp.mp.microsoft.com", "service": "Steuerung der Aktualisierungsauslieferung", "process": "svchost.exe", "categories": ["Aktualisierungssteuerung"], "trigger": "Bei Aktualisierungsvorgängen", "severity": "update", "evidence": "documented", "editions": ["Home", "Pro", "Education"] },
    { "domain": "adl.windows.com", "service": "Kompatibilitätsdatenbank", "process": "CompatTelRunner.exe", "categories": ["Installierte Programme", "Treiber", "Hardwarekennungen", "Kompatibilitätsbefunde"], "trigger": "Geplante Aufgabe Compatibility Appraiser", "severity": "telemetry", "evidence": "documented", "editions": ["Home", "Pro", "Education", "Enterprise"] },
    { "domain": "ctldl.windowsupdate.com", "service": "Aktualisierung der Stammzertifikatsliste", "process": "svchost.exe (CryptSvc)", "categories": ["Keine Nutzerdaten"], "trigger": "Bei Prüfung unbekannter Zertifizierungsstellen", "severity": "security", "evidence": "documented", "editions": ["Home", "Pro", "Education", "Enterprise"] },
    { "domain": "activity.windows.com", "service": "Aktivitätsverlauf und Geräteübergreifende Fortsetzung", "process": "svchost.exe (CDPUserSvc)", "categories": ["Geöffnete Anwendungen", "Geöffnete Dokumente", "Zeitstempel"], "trigger": "Bei aktiviertem Verlauf und angemeldetem Konto", "severity": "telemetry", "evidence": "documented", "editions": ["Home", "Pro", "Education"] },
    { "domain": "cs.dds.microsoft.com", "service": "Zuordnung von Konten und Geräten", "process": "svchost.exe", "categories": ["Gerätemetadaten", "Kontozuordnung"], "trigger": "Bei Kontoanmeldung", "severity": "telemetry", "evidence": "documented", "editions": ["Home"] },
    { "domain": "dmd.metaservices.microsoft.com", "service": "Abruf von Gerätemetadaten", "process": "svchost.exe", "categories": ["Hardwarekennungen angeschlossener Geräte"], "trigger": "Bei Geräteanschluss", "severity": "telemetry", "evidence": "documented", "editions": ["Home", "Pro", "Education"] },
    { "domain": "login.live.com", "service": "Geräte- und Kontoauthentifizierung", "process": "svchost.exe", "categories": ["Anmeldedaten", "Gerätetoken"], "trigger": "Anmeldung und Tokenerneuerung", "severity": "account", "evidence": "documented", "editions": ["Home", "Pro", "Education"] },
    { "domain": "logincdn.msauth.net", "service": "Auslieferung von Anmelderessourcen", "process": "diverse", "categories": ["Keine Nutzerdaten"], "trigger": "Bei Anmeldevorgängen", "severity": "account", "evidence": "documented", "editions": ["Home", "Pro", "Education"] },